{
  "$schema": "https://json-schema.org/draft/2020-12/schema",
  "$id": "https://notariat8.de/schemas/github-identity-registry.schema.json",
  "$comment": "SPDX-License-Identifier: AGPL-3.0-or-later",
  "type": "object",
  "additionalProperties": false,
  "required": ["version", "principals", "accounts"],
  "properties": {
    "version": { "const": 2 },
    "description": { "type": "string", "minLength": 1 },
    "role_aliases": {
      "type": "object",
      "additionalProperties": { "type": "string", "minLength": 1 }
    },
    "principals": {
      "type": "array",
      "items": {
        "type": "object",
        "additionalProperties": false,
        "required": ["principal_id", "technical_role_ids", "qualifications", "active"],
        "properties": {
          "principal_id": { "type": "string", "pattern": "^person:[a-z0-9][a-z0-9-]*$" },
          "technical_role_ids": { "type": "array", "minItems": 1, "items": { "type": "string", "minLength": 1 }, "uniqueItems": true },
          "qualifications": { "type": "array", "minItems": 1, "items": { "type": "string", "minLength": 1 }, "uniqueItems": true },
          "active": { "type": "boolean" }
        }
      }
    },
    "accounts": {
      "type": "array",
      "items": {
        "type": "object",
        "additionalProperties": false,
        "required": ["account_id", "provider", "login", "principal_id", "active"],
        "properties": {
          "account_id": { "type": "string", "pattern": "^[a-z0-9-]+:[^:]+$" },
          "provider": { "type": "string", "pattern": "^[a-z0-9-]+$" },
          "login": { "type": "string", "minLength": 1 },
          "principal_id": { "type": "string", "pattern": "^person:[a-z0-9][a-z0-9-]*$" },
          "active": { "type": "boolean" }
        }
      }
    }
  }
}
