{
  "version": 2,
  "description": "Source of truth for provider-qualified accounts, stable principals, and governance roles.",
  "role_aliases": {
    "notar": "notar_fachlich",
    "notarin": "notar_fachlich",
    "notariatsfachkraft": "notariatsfachkraft",
    "notarfachangestellte": "notariatsfachkraft",
    "notarfachangestellter": "notariatsfachkraft",
    "mitarbeiter": "mitarbeiter",
    "mitarbeiterin": "mitarbeiter",
    "praktikant": "mitarbeiter",
    "praktikantin": "mitarbeiter"
  },
  "principals": [
    {
      "principal_id": "person:oliver-funk",
      "technical_role_ids": [
        "prozessverantwortung"
      ],
      "qualifications": [
        "process_design"
      ],
      "active": true
    }
  ],
  "accounts": [
    {
      "account_id": "github:ofunk",
      "provider": "github",
      "login": "ofunk",
      "principal_id": "person:oliver-funk",
      "active": true
    },
    {
      "account_id": "github:ofunk-nvidia",
      "provider": "github",
      "login": "ofunk-nvidia",
      "principal_id": "person:oliver-funk",
      "active": true
    },
    {
      "account_id": "nvidia-gitlab:ofunk",
      "provider": "nvidia-gitlab",
      "login": "ofunk",
      "principal_id": "person:oliver-funk",
      "active": true
    }
  ]
}
